{
  "version": 1,
  "artifactType": "knowledge_corpus_review_packet",
  "revisionId": "pv1-symptom-evidence-guides:draft-002",
  "supersedesRevisionId": "pv1-symptom-evidence-guides:draft-001",
  "createdOn": "2026-08-26",
  "evidenceScope": "resolved_runtime_material_and_draft_claim_map",
  "cohort": {
    "id": "PV1-SYMPTOM-EVIDENCE-GUIDES",
    "registrySourcePullRequest": 627,
    "cohortProvenanceSourceId": "source:pr-627-route-cohort-provenance",
    "paths": [
      "/guides/cannabis-burnt-crispy-leaf-tips",
      "/guides/cannabis-leaf-spots-lesions",
      "/guides/cannabis-leaf-symptoms",
      "/guides/cannabis-leaves-turning-yellow"
    ],
    "sourceRouteState": "registered_public",
    "editorialState": "sourced",
    "publicationReadiness": "BLOCKED"
  },
  "statusEvidence": {
    "publicationStatus": "NOT_MEASURED",
    "renderedCrawlStatus": "NOT_MEASURED"
  },
  "assignments": {
    "managingEditorId": null,
    "authorIds": [],
    "evidenceReviewerIds": [],
    "cultivationReviewerIds": []
  },
  "aiAssistance": {
    "tool": "Codex",
    "usedOn": "2026-08-26",
    "uses": [
      "claim-map organization",
      "draft packet assembly",
      "source discovery and organization",
      "runtime material receipt calculation"
    ],
    "humanVerifierId": null
  },
  "sources": [
    {
      "id": "source:aps-plant-disease-diagnosis",
      "sourceType": "evidence",
      "title": "Plant Disease Diagnosis",
      "url": "https://www.apsnet.org/edcenter/Pages/PlantDiseaseDiagnosis.aspx",
      "publisher": "American Phytopathological Society",
      "authors": ["Melissa B. Riley", "Margaret R. Williamson", "Otis Maloy"],
      "evidenceTier": "B",
      "publishedOn": null,
      "versionDate": null,
      "accessedOn": "2026-08-26",
      "stableIdentifier": "doi:10.1094/PHI-I-2002-1021-01",
      "archiveLocator": null,
      "license": "not_assessed",
      "limitations": [
        "General plant-disease diagnostic guidance; it is not cannabis-specific.",
        "It supports a hypothesis-testing method and the need for converging evidence, not identification of a particular pest, pathogen, or deficiency from one symptom."
      ]
    },
    {
      "id": "source:csu-diagnosing-plant-disorders",
      "sourceType": "evidence",
      "title": "Diagnosing Plant Disorders",
      "url": "https://extension.colostate.edu/resource/diagnosing-plant-disorders/",
      "publisher": "Colorado State University Extension",
      "authors": ["David Whiting", "Carol O’Meara", "Mary Small"],
      "evidenceTier": "A",
      "publishedOn": null,
      "versionDate": null,
      "accessedOn": "2026-08-26",
      "stableIdentifier": "url:https://extension.colostate.edu/resource/diagnosing-plant-disorders/",
      "archiveLocator": null,
      "license": "not_assessed",
      "limitations": [
        "General extension guidance for diagnosing plant disorders; it is not cannabis-specific.",
        "Its examples are not evidence that the same cause applies to a cannabis plant, cultivar, medium, facility, or growth stage."
      ]
    },
    {
      "id": "source:frontiers-2021-cannabis-light-intensity",
      "sourceType": "evidence",
      "title": "Cannabis Yield, Potency, and Leaf Photosynthesis Respond Differently to Increasing Light Levels in an Indoor Environment",
      "url": "https://pmc.ncbi.nlm.nih.gov/articles/PMC8144505/",
      "publisher": "Frontiers in Plant Science",
      "authors": ["Victoria Rodriguez-Morrison", "David Llewellyn", "Youbin Zheng"],
      "evidenceTier": "A",
      "publishedOn": "2021-05-11",
      "versionDate": null,
      "accessedOn": "2026-08-26",
      "stableIdentifier": "doi:10.3389/fpls.2021.646020",
      "archiveLocator": "pmc:PMC8144505",
      "license": "CC BY 4.0",
      "limitations": [
        "Controlled indoor flowering study with one cannabis cultivar and study-specific light treatments.",
        "It provides light-response context but does not diagnose tip damage, prove light burn from appearance, or establish a universal threshold across cultivars and facilities."
      ]
    },
    {
      "id": "source:frontiers-2025-cannabis-root-zone-nutrients",
      "sourceType": "evidence",
      "title": "Elevated root-zone P and nutrient concentration do not increase yield or cannabinoids in medical cannabis",
      "url": "https://pmc.ncbi.nlm.nih.gov/articles/PMC11882401/",
      "publisher": "Frontiers in Plant Science",
      "authors": ["Julie A. Hershkowitz", "F. Mitchell Westmoreland", "Bruce Bugbee"],
      "evidenceTier": "A",
      "publishedOn": "2025-02-20",
      "versionDate": null,
      "accessedOn": "2026-08-26",
      "stableIdentifier": "doi:10.3389/fpls.2025.1433985",
      "archiveLocator": "pmc:PMC11882401",
      "license": "CC BY 4.0",
      "limitations": [
        "Controlled medical-cannabis study with its own cultivar, root-zone, nutrient, and facility conditions.",
        "Its reported absence of leaf necrosis under the tested higher nutrient conditions limits overgeneralization; it does not rule out salt or nutrient injury under other conditions and does not diagnose a plant from tip appearance."
      ]
    },
    {
      "id": "source:mdpi-2023-cannabis-single-element-deficiencies",
      "sourceType": "evidence",
      "title": "Foliar Symptomology, Nutrient Content, Yield, and Secondary Metabolite Variability of Cannabis Grown Hydroponically with Different Single-Element Nutrient Deficiencies",
      "url": "https://pmc.ncbi.nlm.nih.gov/articles/PMC9920212/",
      "publisher": "Plants",
      "authors": ["David Llewellyn", "Scott Golem", "A. Maxwell P. Jones", "Youbin Zheng"],
      "evidenceTier": "A",
      "publishedOn": "2023-01-17",
      "versionDate": null,
      "accessedOn": "2026-08-26",
      "stableIdentifier": "doi:10.3390/plants12030422",
      "archiveLocator": "pmc:PMC9920212",
      "license": "CC BY 4.0",
      "limitations": [
        "Controlled hydroponic flowering study using one cultivar and induced single-element deficiencies.",
        "Observed symptom patterns do not establish that appearance alone identifies a deficiency in other cultivars, media, facilities, stages, or multi-factor grow conditions."
      ]
    },
    {
      "id": "source:penn-state-hydroponic-plant-nutrition",
      "sourceType": "evidence",
      "title": "Hydroponics Systems and Principles Of Plant Nutrition: Essential Nutrients, Function, Deficiency, and Excess",
      "url": "https://extension.psu.edu/hydroponics-systems-and-principles-of-plant-nutrition-essential-nutrients-function-deficiency-and-excess",
      "publisher": "Penn State Extension",
      "authors": [
        "Elsa Sánchez",
        "Francesco Di Gioia",
        "Robert Berghage",
        "Nick Flax",
        "Thomas Ford"
      ],
      "evidenceTier": "A",
      "publishedOn": null,
      "versionDate": "2026-02-02",
      "accessedOn": "2026-08-26",
      "stableIdentifier": "url:https://extension.psu.edu/hydroponics-systems-and-principles-of-plant-nutrition-essential-nutrients-function-deficiency-and-excess",
      "archiveLocator": null,
      "license": "not_assessed",
      "limitations": [
        "General hydroponic plant-nutrition guidance with examples from non-cannabis crops.",
        "It does not establish a cannabis diagnosis, a universal EC or pH target, or a flush prescription from symptom appearance."
      ]
    },
    {
      "id": "source:pr-627-route-cohort-provenance",
      "sourceType": "cohort_provenance",
      "title": "PR #627 route-cohort authorization and lineage",
      "url": "https://github.com/Verdant-OS/verdant-grow-diary/pull/627",
      "publisher": "Verdant-OS/verdant-grow-diary",
      "authors": ["cheekhimself"],
      "evidenceTier": "D",
      "publishedOn": null,
      "versionDate": null,
      "accessedOn": "2026-08-26",
      "stableIdentifier": "https://github.com/Verdant-OS/verdant-grow-diary/pull/627",
      "archiveLocator": null,
      "license": "not_assessed",
      "limitations": [
        "This record establishes only that the four routes were an approved post-v1 implementation cohort and records their repository lineage.",
        "It is not scientific evidence, evidence review, cultivation review, editorial approval, publication verification, or rendered-crawl verification, and no claim may cite it as support."
      ]
    },
    {
      "id": "source:umd-excess-fertilizer-salt-damage",
      "sourceType": "evidence",
      "title": "Excess Fertilizer or Salt Damage on Flowers",
      "url": "https://www.extension.umd.edu/resource/excess-fertilizer-or-salt-damage-flowers",
      "publisher": "University of Maryland Extension",
      "authors": [],
      "evidenceTier": "A",
      "publishedOn": null,
      "versionDate": "2023-03-07",
      "accessedOn": "2026-08-26",
      "stableIdentifier": "url:https://www.extension.umd.edu/resource/excess-fertilizer-or-salt-damage-flowers",
      "archiveLocator": null,
      "license": "not_assessed",
      "limitations": [
        "General extension guidance for ornamental flowers and garden soils; it is not cannabis-specific.",
        "Marginal browning and scorch are nonspecific, and this source does not justify diagnosing salt injury or prescribing leaching for cannabis from appearance alone."
      ]
    }
  ],
  "claims": [
    {
      "id": "claim:burnt-crispy-leaf-tips:controlled-follow-up",
      "path": "/guides/cannabis-burnt-crispy-leaf-tips",
      "claimType": "cultivation_safety_boundary",
      "wordingState": "bounded",
      "evidenceState": "sourced_pending_review",
      "riskClass": "R2",
      "riskDomains": ["environment", "irrigation", "lighting", "nutrition"],
      "text": "Avoid stacking feeding, watering, lighting, and airflow corrections; preserve a baseline and record the response to one justified, grower-approved change.",
      "sourceLinks": [
        {
          "sourceId": "source:csu-diagnosing-plant-disorders",